{
  "bilingualSummary": {
    "EN": "AI Labor Transition Monitor\nOccupational data through: 2026-08\nAI adoption: Observed business use: 23.8% (2026-09-06); expected use: 27.6% (six-month survey expectation); separate from occupational exposure\nNominal weekly earnings: INSUFFICIENT_EVIDENCE (annual endpoint 2024)\nEmployment divergence: INSUFFICIENT_EVIDENCE (annual endpoint 2024)\nUsual hours: INSUFFICIENT_EVIDENCE (annual endpoint 2024)\nYoung-worker composition: INSUFFICIENT_EVIDENCE (annual endpoint 2024)\nMethodology agreement: DESCRIPTIVELY_CONSISTENT\nChange: NO_ECONOMIC_CHANGE\nSource health: btos: CURRENT; ces: CURRENT; cps: PARTIAL; jolts: CURRENT\nMatched coverage: academic: 37.8%; microsoft: 47.6%. Employment pretrend gaps: academic: +0.20 pp/year; microsoft: -1.18 pp/year.\nEvidence limitations: partial coverage, pretrends, survey uncertainty, earnings comparability.\nCausality: NOT ESTABLISHED. Not an AI unemployment forecast. Email delivery disabled.",
    "ZH": "AI 劳动力转型观察\n职业数据截至：2026-08\nAI 使用：企业实际使用：23.8%（2026-09-06）；预计使用：27.6%（未来六个月调查预期）；不等同于职业暴露\n名义周收入：证据不足（完整年度截至 2024）\n就业差异：证据不足（完整年度截至 2024）\n通常工时：证据不足（完整年度截至 2024）\n年轻劳动者构成：证据不足（完整年度截至 2024）\n方法一致性：DESCRIPTIVELY_CONSISTENT\n本次变化：NO_ECONOMIC_CHANGE\n数据健康：btos: CURRENT; ces: CURRENT; cps: PARTIAL; jolts: CURRENT\n匹配覆盖：academic: 37.8%; microsoft: 47.6%。就业既有趋势差：academic: +0.20 pp/year; microsoft: -1.18 pp/year。\n证据限制：覆盖不完整、既有趋势、调查不确定性及收入可比性。\n因果关系：尚未确立。不是 AI 失业预测。邮件发送关闭。"
  },
  "dataHealth": {
    "btos": {
      "coverageNotes": [
        "Original and broadened AI questions are separate histories",
        "No collection for 202521–202523; no synthetic backfill",
        "Original archive has no publication dates"
      ],
      "economicContentHash": "3f3e125e449217e6caf5a598b58cb4b04e8c6303339e4b4d60a7d0ac663582e5",
      "failure": null,
      "freshnessPolicy": "Research monitoring allowance; not a publisher release calendar",
      "interpretationGuardrail": "Observed labor-market changes are not attributed to AI. Age is not job seniority.",
      "lastSuccessfulFetch": "2026-10-05T22:39:02Z",
      "manifestHash": "eb44cb456a1787c04d093ea98bdfefc97e54c642abbdefe28a6f9349ec43ec77",
      "maxObservationAgeDays": 60,
      "missingPeriods": {},
      "observationThrough": "2026-09-06",
      "officialSourcePage": "https://www.census.gov/hfp/btos/data_downloads",
      "provider": "btos",
      "publisher": "U.S. Census Bureau",
      "releaseLag": "Biweekly; use workbook publication and collection/reference dates",
      "revisionFlag": "revisable_current_vintage",
      "schemaValid": true,
      "snapshotHash": "9287cb03f0b1a5e51e7d3d589d589afc2c6b42333d09c4c9b4147d243440c92b",
      "sourceChanged": false,
      "sourceReleaseDate": "2026-09-24",
      "status": "CURRENT",
      "usingLastValid": false
    },
    "ces": {
      "coverageNotes": [],
      "economicContentHash": "89234d559e372e3975aba85513d8342d26a1ea76974bcdac28996cdc40fe16d1",
      "failure": null,
      "freshnessPolicy": "Research monitoring allowance; not a publisher release calendar",
      "interpretationGuardrail": "Observed labor-market changes are not attributed to AI. Age is not job seniority.",
      "lastSuccessfulFetch": "2026-10-05T22:38:58Z",
      "manifestHash": "7b277a0dec4edfdbd83549fb8dd140c473d89c0dc388b9670ce6ad9a557533af",
      "maxObservationAgeDays": 75,
      "missingPeriods": {},
      "observationThrough": "2026-09-30",
      "officialSourcePage": "https://www.bls.gov/ces/",
      "provider": "ces",
      "publisher": "U.S. Bureau of Labor Statistics",
      "releaseLag": "Monthly, normally early following month; API omits release dates",
      "revisionFlag": "revisable_current_vintage",
      "schemaValid": true,
      "snapshotHash": "cb13d9b3cd0c74572448682803d1d083adbb8fd4df102df8ecc9d6de9e207399",
      "sourceChanged": false,
      "sourceReleaseDate": null,
      "status": "CURRENT",
      "usingLastValid": false
    },
    "cps": {
      "coverageNotes": [
        "Published subgroup cell sample counts/standard errors are not supplied by API",
        "October 2025 missing values remain null",
        "Age is not job seniority"
      ],
      "economicContentHash": "1398faf60299b2abde23b135b22ca002c75b2a22d44da2a7c1e1775bee72b41d",
      "failure": null,
      "freshnessPolicy": "Research monitoring allowance; not a publisher release calendar",
      "interpretationGuardrail": "Observed labor-market changes are not attributed to AI. Age is not job seniority.",
      "lastSuccessfulFetch": "2026-10-05T22:38:57Z",
      "manifestHash": "a5acc809506486eb5da5233c666de2d1a0023ca837968caf2038222731d63533",
      "maxObservationAgeDays": 75,
      "missingPeriods": {
        "LNS11300000": [
          "2025-10"
        ],
        "LNS11300036": [
          "2025-10"
        ],
        "LNS11300060": [
          "2025-10"
        ],
        "LNS11300089": [
          "2025-10"
        ],
        "LNS12300000": [
          "2025-10"
        ],
        "LNS12300036": [
          "2025-10"
        ],
        "LNS12300060": [
          "2025-10"
        ],
        "LNS12300089": [
          "2025-10"
        ],
        "LNS14000000": [
          "2025-10"
        ],
        "LNS14000036": [
          "2025-10"
        ],
        "LNS14000060": [
          "2025-10"
        ],
        "LNS14000089": [
          "2025-10"
        ]
      },
      "observationThrough": "2026-09-30",
      "officialSourcePage": "https://www.bls.gov/cps/data.htm",
      "provider": "cps",
      "publisher": "U.S. Bureau of Labor Statistics",
      "releaseLag": "Monthly, normally early following month; API omits release dates",
      "revisionFlag": "revisable_current_vintage",
      "schemaValid": true,
      "snapshotHash": "95a367bfc48648c83ea7aa89a9e453cd43ce0a9fa72ad98024865fae16302689",
      "sourceChanged": false,
      "sourceReleaseDate": null,
      "status": "PARTIAL",
      "usingLastValid": false
    },
    "jolts": {
      "coverageNotes": [],
      "economicContentHash": "c0577ee6965719d05325eae4bb9e82bad98e3b590253c5ef0ed3f993bc115d74",
      "failure": null,
      "freshnessPolicy": "Research monitoring allowance; not a publisher release calendar",
      "interpretationGuardrail": "Observed labor-market changes are not attributed to AI. Age is not job seniority.",
      "lastSuccessfulFetch": "2026-10-05T22:39:00Z",
      "manifestHash": "46d942cf1901d29aa28b3823b80799eaf39e3a873fa0bfbf261bf360997deca6",
      "maxObservationAgeDays": 110,
      "missingPeriods": {},
      "observationThrough": "2026-08-31",
      "officialSourcePage": "https://www.bls.gov/jlt/",
      "provider": "jolts",
      "publisher": "U.S. Bureau of Labor Statistics",
      "releaseLag": "Monthly, generally several weeks after reference month; API omits release dates",
      "revisionFlag": "revisable_current_vintage",
      "schemaValid": true,
      "snapshotHash": "10e804007c38867698b545a191121c35972852e3bc8e07606f8da8d79fdd8e01",
      "sourceChanged": false,
      "sourceReleaseDate": null,
      "status": "CURRENT",
      "usingLastValid": false
    }
  },
  "economicChange": "NO_ECONOMIC_CHANGE",
  "emailDelivery": "DISABLED",
  "evaluationDate": "2026-10-06T04:35:39Z",
  "evaluationId": "9c65350db439ee246408614201380bef40971f79a4ea2968084b861ab8c4b747",
  "evidence": {
    "causality": "NOT_ESTABLISHED",
    "causalityStatus": "DESCRIPTIVE_ONLY",
    "emailDelivery": "DISABLED",
    "implementationIdentity": "2fc08242488189d8af0eed8c280424590307304c99666b73942458381add4da3",
    "implementationVersion": "0.1.0",
    "interpretationGuardrail": "Observed differences across AI-exposure groups do not establish that AI caused those differences.",
    "limitations": [
      "PARTIAL_OCCUPATIONAL_COVERAGE",
      "DESIGN_SE_UNAVAILABLE",
      "AGE_NOT_SENIORITY",
      "OCCUPATIONAL_HIRING_UNAVAILABLE",
      "EXPOSURE_NOT_CAUSAL_TREATMENT",
      "EARNINGS_DISCLOSURE_BREAK",
      "PANDEMIC_AND_POPULATION_CONTROL_BREAKS",
      "CURRENT_VINTAGE_RECONSTRUCTION_NOT_REALTIME_BACKTEST"
    ],
    "methodologyAgreement": {
      "earnings": {
        "adequateCoverageBoth": false,
        "agreementDoesNotEstablishCausality": true,
        "commonSample": {
          "adequateCoverageBoth": false,
          "agreementDoesNotEstablishCausality": true,
          "commonSample": null,
          "gapDifference": null,
          "status": "INSUFFICIENT_EVIDENCE"
        },
        "gapDifference": null,
        "status": "INSUFFICIENT_EVIDENCE"
      },
      "employment": {
        "adequateCoverageBoth": false,
        "agreementDoesNotEstablishCausality": true,
        "commonSample": {
          "adequateCoverageBoth": false,
          "agreementDoesNotEstablishCausality": true,
          "commonSample": null,
          "gapDifference": 0.21871335188030638,
          "status": "DESCRIPTIVELY_CONSISTENT"
        },
        "gapDifference": 0.14618389824549993,
        "status": "DESCRIPTIVELY_CONSISTENT"
      },
      "hours": {
        "adequateCoverageBoth": false,
        "agreementDoesNotEstablishCausality": true,
        "commonSample": {
          "adequateCoverageBoth": false,
          "agreementDoesNotEstablishCausality": true,
          "commonSample": null,
          "gapDifference": 0.12190010066626655,
          "status": "DESCRIPTIVELY_CONSISTENT"
        },
        "gapDifference": 0.08562057317651295,
        "status": "DESCRIPTIVELY_CONSISTENT"
      },
      "youngWorkers": {
        "adequateCoverageBoth": false,
        "agreementDoesNotEstablishCausality": true,
        "commonSample": {
          "adequateCoverageBoth": false,
          "agreementDoesNotEstablishCausality": true,
          "commonSample": null,
          "gapDifference": 0.33181060935984497,
          "status": "DESCRIPTIVELY_CONSISTENT"
        },
        "gapDifference": 0.7334944396479457,
        "status": "DESCRIPTIVELY_CONSISTENT"
      }
    },